"What are the five pillars of the AWS Well-Architected Framework?","Operational Excellence, Security, Reliability, Performance Efficiency, Cost Optimization"
"What is the purpose of the Operational Excellence pillar in AWS Well-Architected Framework?","To run and monitor systems to deliver business value and to continually improve supporting processes and procedures."
"What does the Security pillar focus on in AWS Well-Architected Framework?","Protecting information, systems, and assets while delivering business value through risk assessments and mitigation strategies."
"How does the Reliability pillar define its goal within AWS Well-Architected Framework?","Ensuring a workload performs its intended function correctly and consistently when it's expected to, including the ability to operate and test recovery procedures."
"What is the aim of Performance Efficiency in AWS Well-Architected Framework?","Using compute resources efficiently to meet system requirements and to maintain efficiency as demand changes and technologies evolve."
"What is the purpose of the Cost Optimization pillar in the AWS Well-Architected Framework?","To avoid or eliminate unneeded costs or suboptimal resources."